{
  "$schema": "./__meta__.schema.json",
  "$id": "https://dev.datannur.com/schemas/dataset.schema.json",
  "x-db": "data",
  "title": "dataset",
  "description": "Catalog datasets",
  "x-description-fr": "Datasets du catalogue",
  "type": "array",
  "items": {
    "type": "object",
    "required": ["id"],
    "additionalProperties": false,
    "patternProperties": {
      "^[a-z_]+:[a-z]{2}$": {
        "type": ["string", "null"],
        "description": "Localized variant (<field>:<lang>) of a translatable field",
        "x-description-fr": "Variante localisée (<champ>:<langue>) d'un champ traduisible"
      }
    },
    "properties": {
      "id": {
        "type": "string",
        "description": "Primary key of the dataset",
        "x-description-fr": "Clé primaire du dataset"
      },
      "folder_id": {
        "type": ["string", "number", "null"],
        "description": "Key of the folder containing the dataset",
        "x-description-fr": "Clé du dossier contenant le dataset"
      },
      "manager_organization_id": {
        "type": ["string", "number", "null"],
        "description": "Key of the managing organization",
        "x-description-fr": "Clé de l'organisation gestionnaire du dataset"
      },
      "owner_organization_id": {
        "type": ["string", "number", "null"],
        "description": "Key of the data provider organization",
        "x-description-fr": "Clé de l'organisation fournisseur du dataset"
      },
      "tag_ids": {
        "type": ["string", "number", "null"],
        "description": "Keys of related tags",
        "x-description-fr": "Clés des mots clés liés",
        "pattern": "^([a-zA-Z0-9_-]+(, ?[a-zA-Z0-9_-]+)*)?$",
        "examples": ["id1,id2,id3", "single-id", null]
      },
      "doc_ids": {
        "type": ["string", "number", "null"],
        "description": "Keys of related documents",
        "x-description-fr": "Clés des docs liés",
        "pattern": "^([a-zA-Z0-9_-]+(, ?[a-zA-Z0-9_-]+)*)?$",
        "examples": ["id1,id2,id3", "single-id", null]
      },
      "name": {
        "type": ["string", "null"],
        "description": "Dataset name",
        "x-description-fr": "Nom du dataset"
      },
      "description": {
        "type": ["string", "null"],
        "description": "Dataset description",
        "x-description-fr": "Description du dataset"
      },
      "data_path": {
        "type": ["string", "null"],
        "description": "Dataset data location",
        "x-description-fr": "Emplacement des données du dataset"
      },
      "delivery_format": {
        "type": ["string", "null"],
        "description": "Delivery format (CSV, XML, ...)",
        "x-description-fr": "Format du dataset livrées (CSV, XML, ...)"
      },
      "license": {
        "type": ["string", "null"],
        "description": "Dataset license",
        "x-description-fr": "Licence du dataset"
      },
      "type": {
        "type": ["string", "null"],
        "description": "Dataset type (useful for general filter)",
        "x-description-fr": "Type de dataset (utile pour le filtre générale)"
      },
      "link": {
        "type": ["string", "null"],
        "description": "Link to the dataset access, source, or reference",
        "x-description-fr": "Lien vers l'accès, la source ou la référence du dataset"
      },
      "has_preview": {
        "type": ["boolean", "integer", "string", "null"],
        "description": "Whether a preview is available at data/db/preview/<dataset_id>",
        "x-description-fr": "Indique si un aperçu est disponible dans data/db/preview/<dataset_id>"
      },
      "localisation": {
        "type": ["string", "null"],
        "description": "Geographic area covered by the dataset",
        "x-description-fr": "Zone géographique concernée par le dataset"
      },
      "crs": {
        "type": ["string", "null"],
        "description": "Coordinate reference system of the dataset geometries (EPSG code), e.g. \"EPSG:2056\"",
        "x-description-fr": "Système de coordonnées des géométries du dataset (code EPSG), ex. « EPSG:2056 »"
      },
      "bbox": {
        "type": ["array", "null"],
        "items": { "type": "number" },
        "minItems": 4,
        "maxItems": 4,
        "description": "Geographic bounding box [west, south, east, north] in WGS84 lon/lat",
        "x-description-fr": "Emprise géographique [ouest, sud, est, nord] en WGS84 lon/lat",
        "examples": [[6.02, 45.8, 10.5, 47.8], null]
      },
      "geometry_type": {
        "type": ["string", "null"],
        "description": "Geometry type for vector datasets: point, linestring, polygon, multipoint, multilinestring, multipolygon, geometrycollection (null for raster or non-geo)",
        "x-description-fr": "Type de géométrie pour les datasets vecteur : point, linestring, polygon, multipoint, multilinestring, multipolygon, geometrycollection (null pour raster ou non-géo)"
      },
      "spatial_resolution": {
        "type": ["number", "null"],
        "description": "Spatial resolution in meters (e.g. raster pixel size)",
        "x-description-fr": "Résolution spatiale en mètres (ex. taille de pixel d'un raster)"
      },
      "nb_row": {
        "type": ["integer", "null"],
        "description": "Number of rows in the dataset",
        "x-description-fr": "Nombre de ligne dans le dataset"
      },
      "schema_signature": {
        "type": ["string", "null"],
        "description": "Opaque technical signature of the dataset schema, useful for detecting structural changes",
        "x-description-fr": "Signature technique opaque du schéma du jeu de données, utile pour détecter les changements de structure"
      },
      "sample_size": {
        "type": ["integer", "null"],
        "description": "Number of rows sampled for frequency analysis",
        "x-description-fr": "Nombre de lignes échantillonnées pour l'analyse de fréquences"
      },
      "nb_resources": {
        "type": ["integer", "null"],
        "description": "Number of resources (files, tables, ...) in the dataset",
        "x-description-fr": "Nombre de ressources (fichiers, tables, ...) dans le dataset"
      },
      "data_size": {
        "type": ["integer", "null"],
        "description": "Size of the dataset in bytes",
        "x-description-fr": "Taille du dataset en octets"
      },
      "start_date": {
        "type": ["string", "number", "null"],
        "description": "Start of the period covered by the dataset",
        "x-description-fr": "Début de la période couverte par le dataset"
      },
      "end_date": {
        "type": ["string", "number", "null"],
        "description": "End of the period covered by the dataset",
        "x-description-fr": "Fin de la période couverte par le dataset"
      },
      "last_update_date": {
        "type": ["string", "number", "null"],
        "description": "Last update date or date-time of the dataset",
        "x-description-fr": "Date ou date-heure de dernière mise à jour du dataset"
      },
      "updating_each": {
        "type": ["string", "null"],
        "description": "Dataset update frequency",
        "x-description-fr": "Fréquence de mise à jour du dataset"
      },
      "no_more_update": {
        "type": ["string", "number", "null"],
        "description": "Dataset is no longer updated and has no next update date",
        "x-description-fr": "Le dataset n'est plus mis à jour et n'a donc pas de date de prochaine mise à jour"
      }
    }
  }
}
