{
  "$schema": "./__meta__.schema.json",
  "$id": "https://dev.datannur.com/schemas/organization.schema.json",
  "x-db": "data",
  "title": "organization",
  "description": "Organizations, they can be owners or managers of folders or datasets",
  "x-description-fr": "Organisations, elles peuvent êtres propriétaires ou gestionnaires de dossiers ou de datasets",
  "type": "array",
  "items": {
    "type": "object",
    "required": ["id"],
    "additionalProperties": false,
    "patternProperties": {
      "^[a-z_]+:[a-z]{2}$": {
        "type": ["string", "null"],
        "description": "Localized variant (<field>:<lang>) of a translatable field",
        "x-description-fr": "Variante localisée (<champ>:<langue>) d'un champ traduisible"
      }
    },
    "properties": {
      "id": {
        "type": "string",
        "description": "Primary key of the organization",
        "x-description-fr": "Clé primaire de l'organisation"
      },
      "parent_id": {
        "type": ["string", "number", "null"],
        "description": "Key of the parent organization",
        "x-description-fr": "Clé de l'organisation parent"
      },
      "tag_ids": {
        "type": ["string", "number", "null"],
        "description": "Keys of related tags",
        "x-description-fr": "Clés des mots clés liés",
        "pattern": "^([a-zA-Z0-9_-]+(, ?[a-zA-Z0-9_-]+)*)?$",
        "examples": ["id1,id2,id3", "single-id", null]
      },
      "doc_ids": {
        "type": ["string", "number", "null"],
        "description": "Keys of related documents",
        "x-description-fr": "Clés des docs liés",
        "pattern": "^([a-zA-Z0-9_-]+(, ?[a-zA-Z0-9_-]+)*)?$",
        "examples": ["id1,id2,id3", "single-id", null]
      },
      "name": {
        "type": ["string", "null"],
        "description": "Organization name",
        "x-description-fr": "Nom de l'organisation"
      },
      "description": {
        "type": ["string", "null"],
        "description": "Organization description",
        "x-description-fr": "Description de l'organisation"
      },
      "email": {
        "type": ["string", "null"],
        "description": "Organization email",
        "x-description-fr": "Email de l'organisation"
      },
      "phone": {
        "type": ["string", "null"],
        "description": "Organization phone number",
        "x-description-fr": "Numéro de téléphone de l'organisation"
      },
      "start_date": {
        "type": ["string", "number", "null"],
        "description": "Start of the period covered by the organization",
        "x-description-fr": "Début de la période couverte par l'organisation"
      },
      "end_date": {
        "type": ["string", "number", "null"],
        "description": "End of the period covered by the organization",
        "x-description-fr": "Fin de la période couverte par l'organisation"
      }
    }
  }
}
