{
  "$schema": "./__meta__.schema.json",
  "$id": "https://dev.datannur.com/schemas/value.schema.json",
  "x-db": "data",
  "title": "value",
  "description": "Values and their description within a enumeration",
  "x-description-fr": "Valeurs et leur description au sein d'une énumération",
  "type": "array",
  "items": {
    "type": "object",
    "required": [],
    "additionalProperties": false,
    "patternProperties": {
      "^[a-z_]+:[a-z]{2}$": {
        "type": ["string", "null"],
        "description": "Localized variant (<field>:<lang>) of a translatable field",
        "x-description-fr": "Variante localisée (<champ>:<langue>) d'un champ traduisible"
      }
    },
    "properties": {
      "enumeration_id": {
        "type": ["string", "number", "null"],
        "description": "Enumeration key",
        "x-description-fr": "Clé de l'énumération"
      },
      "value": {
        "type": ["string", "number", "null"],
        "description": "Value",
        "x-description-fr": "Valeur"
      },
      "description": {
        "type": ["string", "null"],
        "description": "Value description",
        "x-description-fr": "Description de valeur"
      }
    }
  }
}
