{
  "$schema": "./__meta__.schema.json",
  "$id": "https://dev.datannur.com/schemas/variable.schema.json",
  "x-db": "data",
  "title": "variable",
  "description": "Variables contained in datasets",
  "x-description-fr": "Variables contenues dans les datasets",
  "type": "array",
  "items": {
    "type": "object",
    "required": ["id"],
    "additionalProperties": false,
    "patternProperties": {
      "^[a-z_]+:[a-z]{2}$": {
        "type": ["string", "null"],
        "description": "Localized variant (<field>:<lang>) of a translatable field",
        "x-description-fr": "Variante localisée (<champ>:<langue>) d'un champ traduisible"
      }
    },
    "properties": {
      "id": {
        "type": "string",
        "description": "Primary key of the variable",
        "x-description-fr": "Clé primaire de la variable"
      },
      "dataset_id": {
        "type": ["string", "number", "null"],
        "description": "Key of the dataset containing the variable",
        "x-description-fr": "Clé du dataset contenant la variable"
      },
      "enumeration_ids": {
        "type": ["string", "number", "null"],
        "description": "Keys of related enumerations",
        "x-description-fr": "Clé des énumérations liées",
        "pattern": "^([a-zA-Z0-9_-]+(, ?[a-zA-Z0-9_-]+)*)?$",
        "examples": ["id1,id2,id3", "single-id", null]
      },
      "tag_ids": {
        "type": ["string", "number", "null"],
        "description": "Keys of related tags",
        "x-description-fr": "Clés des mots clés liés",
        "pattern": "^([a-zA-Z0-9_-]+(, ?[a-zA-Z0-9_-]+)*)?$",
        "examples": ["id1,id2,id3", "single-id", null]
      },
      "name": {
        "type": ["string", "null"],
        "description": "Variable name",
        "x-description-fr": "Nom de la variable"
      },
      "original_name": {
        "type": ["string", "null"],
        "description": "Original variable name",
        "x-description-fr": "Nom d'origine de la variable"
      },
      "description": {
        "type": ["string", "null"],
        "description": "Variable description",
        "x-description-fr": "Description de la variable"
      },
      "key": {
        "type": ["integer", "null"],
        "description": "Is or is part of a unique key",
        "x-description-fr": "Est ou fait parti d'une clé unique"
      },
      "business_key": {
        "type": ["integer", "null"],
        "description": "Is or is part of a business key",
        "x-description-fr": "Est ou fait partie d'une clé métier"
      },
      "nb_distinct": {
        "type": ["integer", "null"],
        "description": "Number of distinct values in the variable",
        "x-description-fr": "Nombre de valeurs distinctes contenues dans la variable"
      },
      "nb_duplicate": {
        "type": ["integer", "null"],
        "description": "Number of repeated values in the variable",
        "x-description-fr": "Nombre de valeurs répétées contenues dans la variable"
      },
      "nb_missing": {
        "type": ["integer", "null"],
        "description": "Number of missing values in the variable",
        "x-description-fr": "Nombre de valeurs manquantes contenues dans la variable"
      },
      "type": {
        "type": ["string", "null"],
        "description": "Variable datatype",
        "x-description-fr": "Datatype de la variable"
      },
      "start_date": {
        "type": ["string", "number", "null"],
        "description": "Start of the period covered by the variable",
        "x-description-fr": "Début de la période couverte par la variable"
      },
      "end_date": {
        "type": ["string", "number", "null"],
        "description": "End of the period covered by the variable",
        "x-description-fr": "Fin de la période couverte par la variable"
      },
      "min": {
        "type": ["number", "null"],
        "description": "Minimum value (or minimum string length for text variables)",
        "x-description-fr": "Valeur minimale (ou longueur minimale pour les variables texte)"
      },
      "max": {
        "type": ["number", "null"],
        "description": "Maximum value (or maximum string length for text variables)",
        "x-description-fr": "Valeur maximale (ou longueur maximale pour les variables texte)"
      },
      "mean": {
        "type": ["number", "null"],
        "description": "Mean value (or mean string length for text variables)",
        "x-description-fr": "Valeur moyenne (ou longueur moyenne pour les variables texte)"
      },
      "std": {
        "type": ["number", "null"],
        "description": "Standard deviation (or standard deviation of string length for text variables)",
        "x-description-fr": "Écart-type (ou écart-type de la longueur pour les variables texte)"
      },
      "source_variable_ids": {
        "type": ["string", "number", "null"],
        "description": "List of source variable keys (lineage)",
        "x-description-fr": "Liste des clés des variables sources (lineage)",
        "pattern": "^([a-zA-Z0-9_-]+(, ?[a-zA-Z0-9_-]+)*)?$",
        "examples": ["id1,id2,id3", "single-id", null]
      },
      "fk_variable_id": {
        "type": ["string", "number", "null"],
        "description": "Foreign key referencing a variable in another dataset",
        "x-description-fr": "Clé étrangère référençant une variable dans un autre dataset"
      },
      "is_pattern": {
        "type": ["boolean", "integer", "null"],
        "description": "Indicates that frequencies show value patterns instead of raw data",
        "x-description-fr": "Indique que les fréquences affichent les patterns des valeurs plutôt que les données brutes"
      },
      "concept_id": {
        "type": ["string", "number", "null"],
        "description": "Key of the related business concept",
        "x-description-fr": "Clé du concept métier lié"
      }
    }
  }
}
